{
  "$schema": "https://json-schema.org/draft/2020-12/schema",
  "$id": "https://basewright.dev/schema/facts.schema.json",
  "title": "Host facts",
  "description": "What was observed about a host, in the shape the core reads it. This is the contract a collector has to produce: gather runs against a machine and writes this document, and everything downstream reads the normalized model built from it, so a change in how facts are collected cannot ripple into the gate engine or the planner. Nothing here is a judgement. The collector reports what it saw, including which packaging family the operating system belongs to, because a distribution-to-family map living in the core would be exactly the kind of knowledge that has to stay out of it.",
  "type": "object",
  "additionalProperties": false,
  "required": [
    "schema_version",
    "collected_at",
    "host",
    "os",
    "arch",
    "cpu",
    "memory",
    "mounts",
    "network",
    "services",
    "locales",
    "privileges"
  ],
  "properties": {
    "schema_version": {
      "const": "1",
      "description": "The version of this contract. A collector and the core have to agree about it, so it is stated rather than inferred from which fields happen to be present."
    },
    "collected_at": {
      "type": "string",
      "pattern": "^[0-9]{4}-[0-9]{2}-[0-9]{2}T[0-9]{2}:[0-9]{2}:[0-9]{2}Z$",
      "description": "UTC, to the second. Facts have a shelf life: apply re-checks that the host still matches the ones its plan was built from."
    },
    "host": {
      "type": "string",
      "minLength": 1,
      "description": "The host as it was addressed, which is how a plan and a report name it afterwards."
    },
    "os": { "$ref": "#/$defs/os" },
    "arch": {
      "enum": ["x86_64", "amd64", "aarch64", "arm64", "ppc64le", "s390x"],
      "description": "The processor architecture. Both spellings of the same machine are accepted here and resolved on the way in, because which of amd64 and x86_64 a collector happens to report is not something a collector should have to know this project's opinion about. Only the canonical spelling reaches a rule."
    },
    "cpu": { "$ref": "#/$defs/cpu" },
    "memory": { "$ref": "#/$defs/memory" },
    "mounts": {
      "type": "array",
      "minItems": 1,
      "items": { "$ref": "#/$defs/mount" },
      "description": "Every mounted filesystem, not only the interesting ones. Which mount carries a planned path is worked out by matching the longest prefix, and that answer is only right if the list is complete."
    },
    "network": { "$ref": "#/$defs/network" },
    "services": {
      "type": "array",
      "items": { "$ref": "#/$defs/service" },
      "description": "What is already installed and running. May be empty, which is the usual answer on a machine that has just been built. Whether any of it conflicts with what is being provisioned is a question the profile answers, not this document."
    },
    "locales": {
      "type": "array",
      "uniqueItems": true,
      "items": {
        "type": "string",
        "minLength": 1,
        "description": "A locale as the host names it, so that a required one can be looked for exactly rather than approximately."
      },
      "description": "The locales present on the host. An engine initialized with a locale the machine does not have fails at the last possible moment, so this is checked at the first."
    },
    "privileges": { "$ref": "#/$defs/privileges" },
    "time_sync": { "$ref": "#/$defs/time_sync" },
    "kernel": { "$ref": "#/$defs/kernel" },
    "firewall": { "$ref": "#/$defs/firewall" }
  },
  "$defs": {
    "os": {
      "type": "object",
      "additionalProperties": false,
      "required": ["family", "distro", "version"],
      "properties": {
        "family": {
          "type": "string",
          "pattern": "^[a-z][a-z0-9]{1,15}$",
          "description": "The packaging family, as the collector reports it. The core never derives this from the distribution: that map is knowledge about operating systems, and it belongs where the observation is made."
        },
        "distro": {
          "type": "string",
          "pattern": "^[a-z][a-z0-9-]{1,31}$"
        },
        "version": {
          "type": "string",
          "minLength": 1,
          "description": "The version as the distribution writes it, quoted so that 24.04 stays two numbers and a dot."
        },
        "codename": {
          "type": "string",
          "pattern": "^[a-z][a-z0-9-]{1,31}$",
          "description": "The release codename, where the family keys its repositories by one."
        },
        "pretty_name": { "type": "string", "minLength": 1 },
        "kernel": { "type": "string", "minLength": 1 }
      }
    },
    "cpu": {
      "type": "object",
      "additionalProperties": false,
      "required": ["cores"],
      "properties": {
        "cores": {
          "type": "integer",
          "minimum": 1,
          "description": "Physical cores. Sizing that divides by this wants cores and not threads, because two threads on one core do not do twice the work."
        },
        "threads": { "type": "integer", "minimum": 1 },
        "model": { "type": "string", "minLength": 1 }
      }
    },
    "memory": {
      "type": "object",
      "additionalProperties": false,
      "required": ["total_bytes"],
      "properties": {
        "total_bytes": {
          "type": "integer",
          "minimum": 1,
          "description": "Installed memory, in bytes. Sizing is written against this rather than against what happens to be free right now, because a plan has to hold for the life of the instance."
        },
        "available_bytes": { "type": "integer", "minimum": 0 },
        "swap_bytes": { "type": "integer", "minimum": 0 }
      }
    },
    "mount": {
      "type": "object",
      "additionalProperties": false,
      "required": ["path", "filesystem", "total_bytes", "free_bytes"],
      "properties": {
        "path": {
          "type": "string",
          "pattern": "^(/|[A-Za-z]:[\\\\/])",
          "description": "Where the filesystem is mounted. A drive letter is accepted because Windows targets are in scope, and a contract is cheaper to widen before anything depends on it."
        },
        "device": { "type": "string", "minLength": 1 },
        "filesystem": {
          "type": "string",
          "minLength": 1,
          "description": "The filesystem type, as the host names it. Whether it is one the engine is normally run on is the profile's judgement, not this document's."
        },
        "total_bytes": { "type": "integer", "minimum": 0 },
        "free_bytes": { "type": "integer", "minimum": 0 },
        "rotational": {
          "type": "boolean",
          "description": "Whether the underlying device spins. Absent means it could not be determined, which is a different answer from false and is reported as such rather than guessed."
        },
        "options": {
          "type": "array",
          "uniqueItems": true,
          "items": { "type": "string", "minLength": 1 },
          "description": "Mount options. A planned path on a read-only mount is a refusal, and this is where that is visible."
        }
      }
    },
    "network": {
      "type": "object",
      "additionalProperties": false,
      "required": ["listening_ports"],
      "properties": {
        "listening_ports": {
          "type": "array",
          "items": { "$ref": "#/$defs/listening_port" },
          "description": "What is already listening. May be empty. A port that is taken is a refusal with a reason, rather than a service that fails to start after everything else succeeded."
        }
      }
    },
    "listening_port": {
      "type": "object",
      "additionalProperties": false,
      "required": ["port", "address", "protocol"],
      "properties": {
        "port": { "type": "integer", "minimum": 1, "maximum": 65535 },
        "address": { "type": "string", "minLength": 1 },
        "protocol": {
          "enum": ["tcp", "udp"],
          "description": "Which protocol the socket is bound with. A port is only taken for the protocol it is taken on."
        },
        "process": { "type": "string", "minLength": 1 }
      }
    },
    "service": {
      "type": "object",
      "additionalProperties": false,
      "required": ["name", "state"],
      "properties": {
        "name": {
          "type": "string",
          "minLength": 1,
          "description": "The unit or package name as the host knows it. It is matched against what a profile declares, never recognised by the core."
        },
        "version": { "type": "string", "minLength": 1 },
        "state": {
          "enum": ["running", "stopped", "installed"],
          "description": "Running, stopped but present, or installed without a unit. A stopped instance still owns its data directory, so it counts as present."
        },
        "ports": {
          "type": "array",
          "uniqueItems": true,
          "items": { "type": "integer", "minimum": 1, "maximum": 65535 }
        }
      }
    },
    "privileges": {
      "type": "object",
      "additionalProperties": false,
      "required": ["user", "can_escalate"],
      "properties": {
        "user": {
          "type": "string",
          "minLength": 1,
          "description": "The account the facts were collected as. A dedicated technical account, never a personal one."
        },
        "can_escalate": {
          "type": "boolean",
          "description": "Whether that account can run the privileged operations apply needs. Discovering it cannot, halfway through an install, is the outcome this fact exists to prevent."
        }
      }
    },
    "time_sync": {
      "type": "object",
      "additionalProperties": false,
      "required": ["service", "synchronized"],
      "properties": {
        "service": { "type": "string", "minLength": 1 },
        "synchronized": {
          "type": "boolean",
          "description": "Whether the clock is actually in step, not merely whether a daemon is running. A database whose clock jumps is a database whose logs cannot be read against anything else."
        }
      }
    },
    "kernel": {
      "type": "object",
      "additionalProperties": false,
      "properties": {
        "swappiness": {
          "type": "integer",
          "minimum": 0,
          "maximum": 200,
          "description": "How readily the kernel swaps. A database that gets swapped out is a database that has stopped answering."
        },
        "transparent_hugepages": {
          "enum": ["always", "madvise", "never"],
          "description": "The transparent huge page setting. Always is the one that causes latency spikes nobody can explain from inside the database."
        },
        "overcommit_memory": { "type": "integer", "minimum": 0, "maximum": 2 }
      }
    },
    "firewall": {
      "type": "object",
      "additionalProperties": false,
      "required": ["service", "active"],
      "properties": {
        "service": { "type": "string", "minLength": 1 },
        "active": { "type": "boolean" },
        "open_ports": {
          "type": "array",
          "uniqueItems": true,
          "items": { "type": "integer", "minimum": 1, "maximum": 65535 },
          "description": "Ports the firewall already allows. An active firewall that does not admit the planned port is a warning, because opening it may be someone else's decision."
        }
      }
    }
  }
}
