{
  "arch": "x86_64",
  "collected_at": "2026-09-04T08:07:29Z",
  "cpu": {
    "cores": 12,
    "model": "12th Gen Intel(R) Core(TM) i5-12500",
    "threads": 12
  },
  "host": "gather-debian12",
  "kernel": {
    "overcommit_memory": 1,
    "swappiness": 60,
    "transparent_hugepages": "always"
  },
  "locales": [
    "C",
    "C.utf8",
    "POSIX"
  ],
  "memory": {
    "available_bytes": 14792540160,
    "swap_bytes": 4294967296,
    "total_bytes": 16625172480
  },
  "mounts": [
    {
      "device": "/dev/sdd",
      "filesystem": "ext4",
      "free_bytes": 999964696576,
      "options": [
        "rw",
        "relatime",
        "bind"
      ],
      "path": "/etc/hostname",
      "rotational": true,
      "total_bytes": 1081101176832
    },
    {
      "device": "/dev/sdd",
      "filesystem": "ext4",
      "free_bytes": 999964696576,
      "options": [
        "rw",
        "relatime",
        "bind"
      ],
      "path": "/etc/hosts",
      "rotational": true,
      "total_bytes": 1081101176832
    },
    {
      "device": "/dev/sdd",
      "filesystem": "ext4",
      "free_bytes": 999964696576,
      "options": [
        "rw",
        "relatime",
        "bind"
      ],
      "path": "/etc/resolv.conf",
      "rotational": true,
      "total_bytes": 1081101176832
    }
  ],
  "network": {
    "listening_ports": []
  },
  "os": {
    "codename": "bookworm",
    "distro": "debian",
    "family": "debian",
    "kernel": "5.15.167.4-microsoft-standard-WSL2",
    "pretty_name": "Debian 12.15",
    "version": "12.15"
  },
  "privileges": {
    "can_escalate": true,
    "user": "root"
  },
  "schema_version": "1",
  "services": [
    {
      "name": "apt-daily",
      "state": "installed"
    },
    {
      "name": "apt-daily-upgrade",
      "state": "installed"
    },
    {
      "name": "auditd",
      "state": "stopped"
    },
    {
      "name": "autovt@",
      "state": "installed"
    },
    {
      "name": "console-getty",
      "state": "installed"
    },
    {
      "name": "container-getty@",
      "state": "installed"
    },
    {
      "name": "cryptdisks",
      "state": "installed"
    },
    {
      "name": "cryptdisks-early",
      "state": "installed"
    },
    {
      "name": "dbus-org.freedesktop.hostname1",
      "state": "installed"
    },
    {
      "name": "dbus-org.freedesktop.locale1",
      "state": "installed"
    },
    {
      "name": "dbus-org.freedesktop.login1",
      "state": "installed"
    },
    {
      "name": "dbus-org.freedesktop.timedate1",
      "state": "installed"
    },
    {
      "name": "debug-shell",
      "state": "installed"
    },
    {
      "name": "display-manager",
      "state": "stopped"
    },
    {
      "name": "dpkg-db-backup",
      "state": "installed"
    },
    {
      "name": "e2scrub@",
      "state": "installed"
    },
    {
      "name": "e2scrub_all",
      "state": "installed"
    },
    {
      "name": "e2scrub_fail@",
      "state": "installed"
    },
    {
      "name": "e2scrub_reap",
      "state": "installed"
    },
    {
      "name": "emergency",
      "state": "stopped"
    },
    {
      "name": "fstrim",
      "state": "installed"
    },
    {
      "name": "getty-static",
      "state": "installed"
    },
    {
      "name": "getty@",
      "state": "installed"
    },
    {
      "name": "hwclock",
      "state": "installed"
    },
    {
      "name": "hwclock.sh",
      "state": "stopped"
    },
    {
      "name": "initrd-cleanup",
      "state": "stopped"
    },
    {
      "name": "initrd-parse-etc",
      "state": "stopped"
    },
    {
      "name": "initrd-switch-root",
      "state": "stopped"
    },
    {
      "name": "initrd-udevadm-cleanup-db",
      "state": "stopped"
    },
    {
      "name": "kmod",
      "state": "installed"
    },
    {
      "name": "kmod-static-nodes",
      "state": "stopped"
    },
    {
      "name": "modprobe@",
      "state": "installed"
    },
    {
      "name": "modprobe@configfs",
      "state": "stopped"
    },
    {
      "name": "modprobe@dm_mod",
      "state": "stopped"
    },
    {
      "name": "modprobe@fuse",
      "state": "stopped"
    },
    {
      "name": "modprobe@loop",
      "state": "stopped"
    },
    {
      "name": "pam_namespace",
      "state": "installed"
    },
    {
      "name": "plymouth-start",
      "state": "stopped"
    },
    {
      "name": "procps",
      "state": "installed"
    },
    {
      "name": "quotaon",
      "state": "installed"
    },
    {
      "name": "rc",
      "state": "installed"
    },
    {
      "name": "rc-local",
      "state": "installed"
    },
    {
      "name": "rcS",
      "state": "installed"
    },
    {
      "name": "rescue",
      "state": "stopped"
    },
    {
      "name": "serial-getty@",
      "state": "installed"
    },
    {
      "name": "sudo",
      "state": "stopped"
    },
    {
      "name": "syslog",
      "state": "stopped"
    },
    {
      "name": "system-update-cleanup",
      "state": "installed"
    },
    {
      "name": "systemd-ask-password-console",
      "state": "stopped"
    },
    {
      "name": "systemd-ask-password-wall",
      "state": "installed"
    },
    {
      "name": "systemd-backlight@",
      "state": "installed"
    },
    {
      "name": "systemd-binfmt",
      "state": "stopped"
    },
    {
      "name": "systemd-boot-check-no-failures",
      "state": "installed"
    },
    {
      "name": "systemd-exit",
      "state": "installed"
    },
    {
      "name": "systemd-firstboot",
      "state": "stopped"
    },
    {
      "name": "systemd-fsck-root",
      "state": "stopped"
    },
    {
      "name": "systemd-fsck@",
      "state": "installed"
    },
    {
      "name": "systemd-fsckd",
      "state": "stopped"
    },
    {
      "name": "systemd-halt",
      "state": "installed"
    },
    {
      "name": "systemd-hibernate",
      "state": "installed"
    },
    {
      "name": "systemd-hibernate-resume@",
      "state": "installed"
    },
    {
      "name": "systemd-hostnamed",
      "state": "installed"
    },
    {
      "name": "systemd-hybrid-sleep",
      "state": "installed"
    },
    {
      "name": "systemd-initctl",
      "state": "stopped"
    },
    {
      "name": "systemd-journal-flush",
      "state": "stopped"
    },
    {
      "name": "systemd-journald",
      "state": "running"
    },
    {
      "name": "systemd-journald@",
      "state": "installed"
    },
    {
      "name": "systemd-kexec",
      "state": "installed"
    },
    {
      "name": "systemd-localed",
      "state": "installed"
    },
    {
      "name": "systemd-logind",
      "state": "installed"
    },
    {
      "name": "systemd-machine-id-commit",
      "state": "stopped"
    },
    {
      "name": "systemd-modules-load",
      "state": "stopped"
    },
    {
      "name": "systemd-network-generator",
      "state": "installed"
    },
    {
      "name": "systemd-networkd",
      "state": "installed"
    },
    {
      "name": "systemd-networkd-wait-online",
      "state": "installed"
    },
    {
      "name": "systemd-networkd-wait-online@",
      "state": "installed"
    },
    {
      "name": "systemd-pcrphase",
      "state": "stopped"
    },
    {
      "name": "systemd-pcrphase-initrd",
      "state": "stopped"
    },
    {
      "name": "systemd-pcrphase-sysinit",
      "state": "stopped"
    },
    {
      "name": "systemd-poweroff",
      "state": "installed"
    },
    {
      "name": "systemd-pstore",
      "state": "installed"
    },
    {
      "name": "systemd-quotacheck",
      "state": "installed"
    },
    {
      "name": "systemd-random-seed",
      "state": "stopped"
    },
    {
      "name": "systemd-reboot",
      "state": "installed"
    },
    {
      "name": "systemd-remount-fs",
      "state": "stopped"
    },
    {
      "name": "systemd-repart",
      "state": "stopped"
    },
    {
      "name": "systemd-rfkill",
      "state": "installed"
    },
    {
      "name": "systemd-suspend",
      "state": "installed"
    },
    {
      "name": "systemd-suspend-then-hibernate",
      "state": "installed"
    },
    {
      "name": "systemd-sysctl",
      "state": "stopped"
    },
    {
      "name": "systemd-sysext",
      "state": "stopped"
    },
    {
      "name": "systemd-sysusers",
      "state": "stopped"
    },
    {
      "name": "systemd-time-wait-sync",
      "state": "installed"
    },
    {
      "name": "systemd-timedated",
      "state": "installed"
    },
    {
      "name": "systemd-tmpfiles-clean",
      "state": "stopped"
    },
    {
      "name": "systemd-tmpfiles-setup",
      "state": "stopped"
    },
    {
      "name": "systemd-tmpfiles-setup-dev",
      "state": "stopped"
    },
    {
      "name": "systemd-udev-settle",
      "state": "stopped"
    },
    {
      "name": "systemd-udev-trigger",
      "state": "stopped"
    },
    {
      "name": "systemd-udevd",
      "state": "stopped"
    },
    {
      "name": "systemd-update-done",
      "state": "stopped"
    },
    {
      "name": "systemd-update-utmp",
      "state": "stopped"
    },
    {
      "name": "systemd-update-utmp-runlevel",
      "state": "stopped"
    },
    {
      "name": "systemd-user-sessions",
      "state": "stopped"
    },
    {
      "name": "systemd-vconsole-setup",
      "state": "stopped"
    },
    {
      "name": "systemd-volatile-root",
      "state": "installed"
    },
    {
      "name": "user-runtime-dir@",
      "state": "installed"
    },
    {
      "name": "user@",
      "state": "installed"
    },
    {
      "name": "x11-common",
      "state": "installed"
    }
  ]
}
