{
  "schema_version": "1",
  "collected_at": "2026-09-03T10:14:22Z",
  "host": "db-large.invalid",
  "os": {
    "family": "debian",
    "distro": "ubuntu",
    "version": "24.04",
    "codename": "noble",
    "pretty_name": "Ubuntu 24.04.1 LTS",
    "kernel": "6.8.0-45-generic"
  },
  "arch": "amd64",
  "cpu": {
    "cores": 64,
    "threads": 128,
    "model": "EPYC 9354"
  },
  "memory": {
    "total_bytes": 549755813888,
    "available_bytes": 534723428352,
    "swap_bytes": 0
  },
  "mounts": [
    {
      "path": "/",
      "filesystem": "ext4",
      "total_bytes": 107374182400,
      "free_bytes": 88046829568,
      "device": "/dev/nvme0n1p1",
      "rotational": false
    },
    {
      "path": "/var",
      "filesystem": "ext4",
      "total_bytes": 214748364800,
      "free_bytes": 204010946560,
      "device": "/dev/nvme1n1",
      "rotational": false
    },
    {
      "path": "/var/lib",
      "filesystem": "xfs",
      "total_bytes": 8796093022208,
      "free_bytes": 7696581394432,
      "device": "/dev/nvme2n1",
      "rotational": false
    },
    {
      "path": "/var/lib/basewright",
      "filesystem": "xfs",
      "total_bytes": 17592186044416,
      "free_bytes": 16492674416640,
      "device": "/dev/nvme3n1",
      "rotational": false
    },
    {
      "path": "/var/log",
      "filesystem": "ext4",
      "total_bytes": 536870912000,
      "free_bytes": 515396075520,
      "device": "/dev/nvme4n1",
      "rotational": false
    },
    {
      "path": "/backup",
      "filesystem": "xfs",
      "total_bytes": 70368744177664,
      "free_bytes": 65970697666560,
      "device": "/dev/sda1",
      "rotational": true
    },
    {
      "path": "/mnt/readonly",
      "filesystem": "iso9660",
      "total_bytes": 4294967296,
      "free_bytes": 0,
      "rotational": true,
      "options": [
        "ro",
        "nosuid"
      ]
    }
  ],
  "network": {
    "listening_ports": [
      {
        "port": 22,
        "address": "0.0.0.0",
        "protocol": "tcp",
        "process": "sshd"
      },
      {
        "port": 9100,
        "address": "0.0.0.0",
        "protocol": "tcp",
        "process": "node_exporter"
      }
    ]
  },
  "services": [],
  "locales": [
    "C.UTF-8",
    "en_US.UTF-8",
    "de_DE.UTF-8"
  ],
  "privileges": {
    "user": "basewright",
    "can_escalate": true
  },
  "time_sync": {
    "service": "systemd-timesyncd",
    "synchronized": true
  },
  "kernel": {
    "swappiness": 10,
    "transparent_hugepages": "madvise",
    "overcommit_memory": 2
  },
  "firewall": {
    "service": "ufw",
    "active": false,
    "open_ports": []
  }
}
