{
  "schema_version": "1",
  "collected_at": "2026-09-03T10:14:22Z",
  "host": "db-rocky.invalid",
  "os": {
    "family": "rhel",
    "distro": "rocky",
    "version": "9.4",
    "pretty_name": "Rocky Linux 9.4 (Blue Onyx)",
    "kernel": "5.14.0-427.el9.aarch64"
  },
  "arch": "arm64",
  "cpu": {
    "cores": 4,
    "threads": 4,
    "model": "Neoverse-N1"
  },
  "memory": {
    "total_bytes": 17179869184,
    "available_bytes": 15032385536,
    "swap_bytes": 2147483648
  },
  "mounts": [
    {
      "path": "/",
      "filesystem": "xfs",
      "total_bytes": 64424509440,
      "free_bytes": 47244640256,
      "device": "/dev/nvme0n1p3",
      "rotational": false
    },
    {
      "path": "/var",
      "filesystem": "xfs",
      "total_bytes": 429496729600,
      "free_bytes": 408021893120,
      "device": "/dev/nvme0n1p4"
    }
  ],
  "network": {
    "listening_ports": [
      {
        "port": 22,
        "address": "::",
        "protocol": "tcp",
        "process": "sshd"
      }
    ]
  },
  "services": [
    {
      "name": "chronyd",
      "state": "running"
    }
  ],
  "locales": [
    "C.UTF-8",
    "en_US.UTF-8"
  ],
  "privileges": {
    "user": "basewright",
    "can_escalate": true
  },
  "time_sync": {
    "service": "chronyd",
    "synchronized": true
  },
  "kernel": {
    "swappiness": 30,
    "transparent_hugepages": "always"
  },
  "firewall": {
    "service": "firewalld",
    "active": true,
    "open_ports": [
      22,
      6432
    ]
  }
}
