{
  "schema_version": "1",
  "collected_at": "2026-09-03T10:14:22Z",
  "host": "db-small.invalid",
  "os": {
    "family": "debian",
    "distro": "debian",
    "version": "12",
    "codename": "bookworm",
    "pretty_name": "Debian GNU/Linux 12 (bookworm)",
    "kernel": "6.1.0-25-amd64"
  },
  "arch": "x86_64",
  "cpu": {
    "cores": 2,
    "threads": 2
  },
  "memory": {
    "total_bytes": 2147483648,
    "available_bytes": 1073741824
  },
  "mounts": [
    {
      "path": "/",
      "filesystem": "ext4",
      "total_bytes": 42949672960,
      "free_bytes": 32212254720,
      "device": "/dev/vda1",
      "rotational": true
    }
  ],
  "network": {
    "listening_ports": [
      {
        "port": 22,
        "address": "0.0.0.0",
        "protocol": "tcp",
        "process": "sshd"
      }
    ]
  },
  "services": [],
  "locales": [
    "C.UTF-8"
  ],
  "privileges": {
    "user": "basewright",
    "can_escalate": true
  },
  "kernel": {
    "swappiness": 60,
    "transparent_hugepages": "madvise"
  }
}
